{"actor":{"attribution_confidence":"unattributed"},"changes":[{"after":{"amount":"2.00","id":0},"before":{"amount":"1.00","id":0},"field_changes":[{"changed":true,"data_type":"decimal","new":"2.00","old":"1.00","path":["amount"],"sensitive":false}],"object":{"name":"donations","primary_key":{"id":0},"schema":"kafel"},"operation":"UPDATE","seq":0}],"completeness":{"consumed_offset_key":"3e11fa47-71ca-11e1-9e33-c80aa9429562:0","gap_detected":false,"snapshot_phase":"streaming"},"envelope_id":"5f328d8e-5f92-59cf-bc4d-940e67822b32","evidence":{"event_hash":"sha256:b0266a18cd85b8baea1ee33b5833abe5d51d8cf51da38c84227971b5c4797df6","prev_row_hash":"sha256:0000000000000000000000000000000000000000000000000000000000000000","row_hash":"sha256:8560e22da2e7ca79da5a3dd8404e2c773820026a3f1354c3b5839b551ff3bda6"},"fidelity":{"source_config":{"binlog_format":"ROW","binlog_row_image":"FULL","config_snapshot_id":"cfg","gtid_mode":"ON","log_bin":"ON"},"state":"HEALTHY"},"kind":"transaction","offset":{"binlog_file":"mysql-bin.000042","binlog_pos":1000,"gtid":"3e11fa47-71ca-11e1-9e33-c80aa9429562:0","lsn":null,"resume_token":null,"scn":null},"schema_version":"cce-1.0","source":{"db_id":"kafel-dev-mysql","engine":"mysql","schema":"kafel","server_uuid":"3e11fa47-71ca-11e1-9e33-c80aa9429562"},"transaction":{"commit_ts":"2026-06-04T10:00:00.000Z","ingest_ts":"2026-06-04T10:00:00.000Z","statement_count":1,"tx_id":"3e11fa47-71ca-11e1-9e33-c80aa9429562:0"}}