{"schema_version":"cce-1.0","envelope_id":"18429c63-e829-5721-ae2a-3a39c81093a2","kind":"transaction","source":{"db_id":"kafel-dev-mysql","engine":"mysql","server_uuid":"3e11fa47-71ca-11e1-9e33-c80aa9429562","schema":"kafel"},"transaction":{"tx_id":"3e11fa47-71ca-11e1-9e33-c80aa9429562:2","commit_ts":"2026-06-01T10:00:00.000Z","ingest_ts":"2026-06-01T10:00:00.000Z","statement_count":1},"offset":{"gtid":"3e11fa47-71ca-11e1-9e33-c80aa9429562:2","binlog_file":"mysql-bin.000042","binlog_pos":1002,"lsn":null,"scn":null,"resume_token":null},"fidelity":{"state":"HEALTHY","source_config":{"config_snapshot_id":"cfg","binlog_format":"ROW","binlog_row_image":"FULL","gtid_mode":"ON","log_bin":"ON"}},"completeness":{"consumed_offset_key":"3e11fa47-71ca-11e1-9e33-c80aa9429562:2","gap_detected":false,"snapshot_phase":"streaming"},"actor":{"attribution_confidence":"unattributed"},"changes":[{"seq":0,"operation":"UPDATE","object":{"schema":"kafel","name":"donations","primary_key":{"id":2}},"before":{"id":2,"amount":"1.00"},"after":{"id":2,"amount":"2.00"},"field_changes":[{"path":["amount"],"old":"1.00","new":"2.00","data_type":"decimal","changed":true,"sensitive":false}]}],"evidence":{"event_hash":"sha256:2e750b0b16760b6ebd54e18fe645e849e21fa7b8b6bc49ba66605f1769c552cf","prev_row_hash":"sha256:a07e7e437ecd201697470390a0797363c753afab5a88ca059149f13ef6fc7471","row_hash":"sha256:5fbeea0fef118c6703fca6851af7615b20b520785aa8b90e8ca2b2b24ddeb0b7","worm_object_key":"kafel-dev-mysql/seg-mpyjwdxx-000001/000000.cce.json","segment_id":"seg-mpyjwdxx-000001"}}